{
  "diagnostics": {
    "kernel": "6.17.0-1020-azure",
    "platform": "Linux-6.17.0-1020-azure-x86_64-with-glibc2.39"
  },
  "metrics": {
    "evidence_validation": {
      "iterations": 20,
      "max": 41.974,
      "p50": 40.446,
      "p95": 41.595,
      "samples": [
        40.512,
        41.505,
        40.825,
        40.325,
        40.082,
        39.112,
        41.292,
        41.974,
        40.53,
        39.848,
        40.17,
        40.738,
        40.42,
        40.472,
        41.595,
        40.901,
        40.183,
        39.888,
        40.028,
        40.302
      ],
      "unit": "ms"
    },
    "incremental_validation_1": {
      "changed_files": 1,
      "fixture_root": "temporary_directory",
      "iterations": 20,
      "max": 0.254,
      "p50": 0.152,
      "p95": 0.188,
      "samples": [
        0.254,
        0.174,
        0.159,
        0.158,
        0.185,
        0.153,
        0.151,
        0.15,
        0.149,
        0.152,
        0.188,
        0.165,
        0.152,
        0.151,
        0.152,
        0.15,
        0.149,
        0.179,
        0.149,
        0.149
      ],
      "unit": "ms",
      "validation_scope": "explicit_changed_files"
    },
    "incremental_validation_10": {
      "changed_files": 10,
      "fixture_root": "temporary_directory",
      "iterations": 20,
      "max": 1.427,
      "p50": 1.363,
      "p95": 1.402,
      "samples": [
        1.427,
        1.402,
        1.35,
        1.368,
        1.383,
        1.342,
        1.368,
        1.373,
        1.358,
        1.388,
        1.338,
        1.348,
        1.37,
        1.342,
        1.374,
        1.345,
        1.334,
        1.382,
        1.333,
        1.333
      ],
      "unit": "ms",
      "validation_scope": "explicit_changed_files"
    },
    "incremental_validation_100": {
      "changed_files": 100,
      "fixture_root": "temporary_directory",
      "iterations": 20,
      "max": 13.979,
      "p50": 13.481,
      "p95": 13.796,
      "samples": [
        13.979,
        13.796,
        13.609,
        13.399,
        13.599,
        13.429,
        13.378,
        13.458,
        13.482,
        13.563,
        13.505,
        13.448,
        13.492,
        13.481,
        13.376,
        13.499,
        13.345,
        13.328,
        13.333,
        13.581
      ],
      "unit": "ms",
      "validation_scope": "explicit_changed_files"
    },
    "install_atomic": {
      "iterations": 20,
      "max": 287.823,
      "p50": 265.179,
      "p95": 269.42,
      "samples": [
        266.072,
        262.221,
        266.754,
        266.493,
        269.42,
        267.004,
        267.207,
        265.222,
        269.194,
        263.148,
        265.137,
        262.153,
        262.689,
        262.075,
        264.061,
        261.609,
        261.618,
        287.823,
        268.312,
        264.756
      ],
      "unit": "ms"
    },
    "install_rollback": {
      "expected_exit_code": 1,
      "failure_point": "after_switch",
      "install_root": "temporary_directory",
      "iterations": 20,
      "max": 213.15,
      "p50": 207.584,
      "p95": 210.736,
      "rollback_verified": true,
      "samples": [
        206.104,
        208.669,
        209.208,
        205.591,
        206.558,
        204.969,
        205.874,
        209.094,
        206.767,
        206.065,
        209.333,
        208.696,
        206.829,
        205.561,
        208.55,
        209.491,
        208.315,
        213.15,
        210.736,
        206.852
      ],
      "unit": "ms"
    },
    "installer_lock_contention": {
      "contention_observed": true,
      "install_root": "temporary_directory",
      "iterations": 20,
      "lock_timeout_seconds": 0,
      "max": 8.733,
      "p50": 8.343,
      "p95": 8.724,
      "real_install_touched": false,
      "samples": [
        8.579,
        8.33,
        8.256,
        8.174,
        8.395,
        8.191,
        8.376,
        8.355,
        8.168,
        8.117,
        8.15,
        8.1,
        8.113,
        8.263,
        8.381,
        8.397,
        8.401,
        8.467,
        8.724,
        8.733
      ],
      "unit": "ms"
    },
    "lint_full": {
      "iterations": 20,
      "max": 464.512,
      "p50": 419.656,
      "p95": 440.929,
      "samples": [
        427.272,
        421.567,
        422.203,
        419.486,
        419.328,
        440.929,
        428.108,
        420.156,
        419.826,
        418.942,
        414.294,
        413.102,
        411.373,
        437.3,
        425.241,
        416.636,
        417.272,
        417.746,
        464.512,
        416.555
      ],
      "unit": "ms"
    },
    "package_validation": {
      "iterations": 20,
      "max": 785.524,
      "p50": 447.455,
      "p95": 466.957,
      "samples": [
        785.524,
        461.398,
        450.976,
        455.756,
        466.957,
        446.19,
        443.922,
        441.137,
        443.326,
        455.131,
        447.297,
        459.755,
        447.454,
        452.209,
        447.456,
        445.655,
        439.315,
        446.6,
        442.67,
        447.67
      ],
      "unit": "ms"
    },
    "release_bundle_build": {
      "artifact_bytes": 136924,
      "bundle_kind": "operational_npm_package",
      "deterministic": true,
      "iterations": 20,
      "max": 865.997,
      "output_root": "temporary_directory",
      "p50": 833.844,
      "p95": 863.598,
      "samples": [
        831.784,
        819.496,
        841.355,
        843.021,
        863.598,
        852.002,
        824.801,
        834.268,
        865.997,
        830.091,
        851.051,
        860.392,
        861.315,
        852.872,
        833.421,
        831.478,
        831.628,
        826.857,
        806.318,
        814.583
      ],
      "unit": "ms"
    },
    "route_pack": {
      "fixture_scope": "portable_self_check",
      "iterations": 20,
      "max": 95.963,
      "p50": 91.819,
      "p95": 95.648,
      "samples": [
        95.648,
        95.963,
        93.629,
        92.138,
        91.833,
        92.317,
        93.025,
        92.771,
        91.805,
        91.588,
        93.351,
        91.42,
        93.002,
        91.143,
        91.455,
        91.195,
        90.907,
        90.084,
        91.5,
        91.363
      ],
      "unit": "ms"
    },
    "route_selection": {
      "iterations": 20,
      "max": 182.637,
      "p50": 161.559,
      "p95": 166.421,
      "samples": [
        161.66,
        162.659,
        159.784,
        159.725,
        159.612,
        160.427,
        161.721,
        160.265,
        161.487,
        161.853,
        162.029,
        160.395,
        166.421,
        160.866,
        161.631,
        161.982,
        160.301,
        160.724,
        164.069,
        182.637
      ],
      "unit": "ms"
    },
    "tree_scan_1000": {
      "iterations": 20,
      "max": 54.381,
      "p50": 49.302,
      "p95": 50.442,
      "samples": [
        54.381,
        49.18,
        49.072,
        49.513,
        49.231,
        49.921,
        49.519,
        49.714,
        49.83,
        48.793,
        49.342,
        49.525,
        50.442,
        49.168,
        49.262,
        49.252,
        48.982,
        48.641,
        48.688,
        49.992
      ],
      "unit": "ms"
    },
    "tree_scan_10000": {
      "iterations": 20,
      "max": 550.328,
      "p50": 508.156,
      "p95": 520.033,
      "samples": [
        550.328,
        505.305,
        502.646,
        505.139,
        519.883,
        503.423,
        505.375,
        505.89,
        507.054,
        510.429,
        510.748,
        516.662,
        511.278,
        519.246,
        508.236,
        508.077,
        504.776,
        520.033,
        509.168,
        507.319
      ],
      "unit": "ms"
    },
    "tree_scan_100000": {
      "iterations": 20,
      "max": 5492.71,
      "p50": 5205.101,
      "p95": 5403.642,
      "samples": [
        5492.71,
        5206.623,
        5115.706,
        5253.264,
        5154.542,
        5403.642,
        5142.693,
        5203.578,
        5075.309,
        5239.552,
        5083.867,
        5219.773,
        5118.712,
        5301.144,
        5166.839,
        5341.381,
        5167.994,
        5340.112,
        5173.971,
        5288.976
      ],
      "unit": "ms"
    },
    "validation_cache_cold": {
      "cache_capacity": 32,
      "cache_evictions": 0,
      "cache_hits": 0,
      "cache_misses": 640,
      "iterations": 20,
      "max": 3.231,
      "max_entries_observed": 32,
      "p50": 3.099,
      "p95": 3.209,
      "samples": [
        3.209,
        3.123,
        3.109,
        3.093,
        3.095,
        3.102,
        3.111,
        3.06,
        3.087,
        3.103,
        3.124,
        3.117,
        3.231,
        3.082,
        3.075,
        3.08,
        3.127,
        3.071,
        3.094,
        3.085
      ],
      "unit": "ms",
      "warm": false,
      "working_set": 32
    },
    "validation_cache_overflow": {
      "cache_capacity": 32,
      "cache_evictions": 640,
      "cache_hits": 0,
      "cache_misses": 1280,
      "iterations": 20,
      "max": 6.389,
      "max_entries_observed": 32,
      "p50": 6.202,
      "p95": 6.356,
      "samples": [
        6.356,
        6.309,
        6.195,
        6.192,
        6.198,
        6.212,
        6.319,
        6.237,
        6.184,
        6.168,
        6.324,
        6.389,
        6.203,
        6.201,
        6.217,
        6.201,
        6.224,
        6.158,
        6.173,
        6.156
      ],
      "unit": "ms",
      "warm": false,
      "working_set": 64
    },
    "validation_cache_warm": {
      "cache_capacity": 32,
      "cache_evictions": 0,
      "cache_hits": 640,
      "cache_misses": 0,
      "iterations": 20,
      "max": 2.239,
      "max_entries_observed": 32,
      "p50": 2.203,
      "p95": 2.238,